{
  "schema_id": "AISCC-SYNTHETIC-RESOURCE-V1",
  "schema_version": "1.0.0",
  "resource_id": "repository:synthetic-stockroom",
  "resource_version": "be3dbe304904048b47ebe5e31d78c60a10572f7bc2931fd4058994585eba300d",
  "resource_ref": "repository:synthetic-stockroom@be3dbe304904048b47ebe5e31d78c60a10572f7bc2931fd4058994585eba300d",
  "source_commit": "05185c57a6265a4002050ce25cdfde3dc87e9779",
  "subroot": "examples/synthetic-stockroom/",
  "git_subtree": "f3d9203321ae3535abf8e92a7285da1067f6c55e",
  "file_count": 14,
  "aggregate_algorithm": "AISCC-SOURCE-MANIFEST-SHA256-V1",
  "aggregate_sha256": "be3dbe304904048b47ebe5e31d78c60a10572f7bc2931fd4058994585eba300d",
  "files": [
    {
      "path": ".gitignore",
      "mode": "100644",
      "bytes": 21,
      "sha256": "03824949a66ab6db1429bd078d10d1bc2d75706aa1b756c547f9a7ff541c77cb"
    },
    {
      "path": ".python-version",
      "mode": "100644",
      "bytes": 8,
      "sha256": "f50159fad3f4319868eb38717b91d55843c41e9803014c8de05e116a6d0bcfdc"
    },
    {
      "path": "PROVENANCE.md",
      "mode": "100644",
      "bytes": 916,
      "sha256": "83e55cadfd99ec0fe53f0b6fabd70e93dc5281829b7f7d47fdeab728d0479507"
    },
    {
      "path": "README.md",
      "mode": "100644",
      "bytes": 3628,
      "sha256": "c98195e31173cd2e735b44112b033d3e292e70827571978ad3fb2e8bb05e9489"
    },
    {
      "path": "stockroom/__init__.py",
      "mode": "100644",
      "bytes": 62,
      "sha256": "d1aac4ef42c031fc7ba3804859afdfe9216ad6efedbdf23b62bdc6fba9651b42"
    },
    {
      "path": "stockroom/__main__.py",
      "mode": "100644",
      "bytes": 79,
      "sha256": "307299fda7b77d22c64cb51430ec75e5f59d78e9c948786afb3b2544fe45e4b7"
    },
    {
      "path": "stockroom/cli.py",
      "mode": "100644",
      "bytes": 1701,
      "sha256": "1db02a0f67e880ebe0adcdc76bfec49cd9f1eca2f5ec7d918534001b27f59de7"
    },
    {
      "path": "stockroom/data/catalog.json",
      "mode": "100644",
      "bytes": 190,
      "sha256": "02ee3b0d41166f9a33ac0445a9db289b304a6005b13664e5a80eebea39d4b41a"
    },
    {
      "path": "stockroom/inventory.py",
      "mode": "100644",
      "bytes": 2585,
      "sha256": "6b03fd5774c7dc24dfba70e7ff35acf0794582110fc5c5f0371a0aeb722d6cdb"
    },
    {
      "path": "stockroom/model.py",
      "mode": "100644",
      "bytes": 1767,
      "sha256": "ed385912ab0fe0ab3b9d454a8d2c90edc72199324f09989bda5de9afe3863be1"
    },
    {
      "path": "tests/test_cli.py",
      "mode": "100644",
      "bytes": 4173,
      "sha256": "e432c84d8add1210d45fd2be677be190329449db9e81c7313f3749ddca58dbe6"
    },
    {
      "path": "tests/test_contract.py",
      "mode": "100644",
      "bytes": 5966,
      "sha256": "9b93a776c664a984df156c03aa25ab4d9e6708b7e8f2d241547ad06cc5e5ce3f"
    },
    {
      "path": "tests/test_inventory.py",
      "mode": "100644",
      "bytes": 4050,
      "sha256": "dbe11542333091048908b32eb14cb0d026001d9e9f67d9b0b28d7938b5e13a4e"
    },
    {
      "path": "tools/build.py",
      "mode": "100644",
      "bytes": 1581,
      "sha256": "f02aaea4c347648ca59471b50973c5f571c910c5e7d5e950a62e41e48a74b18f"
    }
  ]
}
